{
  "slug": "backyard-adu-feasibility-reports",
  "title": "Backyard Home (ADU) Feasibility Reports",
  "oneLiner": "Homeowners learn in minutes whether their lot can legally and physically hold a rental unit — before paying an architect.",
  "status": "seed",
  "researchedAt": "2026-07-17",
  "tags": {
    "type": "Consumer reports / lead-gen",
    "market": "Real estate / housing",
    "target": "Homeowners in ADU-friendly states (CA, WA, OR, CO...)",
    "trend": "ADU legalization wave"
  },
  "summary": {
    "problem": "ADU rules vary by city, lot, zoning overlay, setbacks, and utility access. Homeowners can't tell if their backyard qualifies without hiring professionals, so most never start — and the ones who do often pay for feasibility work that returns a 'no'.",
    "solution": "Address-in, report-out: parcel data + local zoning rules + setback/slope analysis produce a feasibility report with buildable envelope, unit size allowed, estimated cost range, and rental income projection. Sell the report, then refer qualified leads to local ADU builders.",
    "wedge": "One metro with clean parcel data and strong ADU demand; the report is the lead magnet for builder referral fees."
  },
  "sources": [
    { "title": "IdeaBrowser — Idea of the Day email, 2026-06-10 (Backyard home reports)", "url": "https://www.ideabrowser.com/" }
  ]
}
